{
  "horse_id": "699971",
  "horse": "example-value",
  "dob": "example-value",
  "age": "example-value",
  "sex": "example-value",
  "sex_code": "gb",
  "colour": "example-value",
  "region": "gb",
  "breeder": "example-value",
  "dam": "example-value",
  "dam_id": "161521",
  "dam_region": "",
  "sire": "example-value",
  "sire_id": "873784",
  "sire_region": "",
  "damsire": "example-value",
  "damsire_id": "269045",
  "damsire_region": "",
  "trainer": "example-value",
  "trainer_id": "457585",
  "trainer_location": "",
  "trainer_14_days": {},
  "owner": "example-value",
  "owner_id": "652759",
  "prev_trainers": [],
  "prev_owners": [],
  "comment": "",
  "spotlight": "",
  "quotes": [],
  "stable_tour": [],
  "medical": [],
  "number": "example-value",
  "draw": "example-value",
  "headgear": "",
  "headgear_run": "",
  "wind_surgery": "",
  "wind_surgery_run": "",
  "past_results_flags": [],
  "lbs": "example-value",
  "ofr": "example-value",
  "rpr": "example-value",
  "ts": "example-value",
  "jockey": "example-value",
  "jockey_id": "646571",
  "silk_url": "",
  "last_run": "example-value",
  "form": "example-value",
  "trainer_rtf": "example-value",
  "odds": []
}